{"$ref":"#/definitions/achievementSchema","definitions":{"achievementSchema":{"type":"object","properties":{"name":{"type":"string"},"date":{"type":"string","format":"date-time"},"placement":{"type":"string"},"icon":{"type":"string"},"iconColor":{"type":"string","default":"orange"},"highlighted":{"type":"boolean","default":false},"images":{"type":"array","items":{"type":"object","properties":{"src":{"type":"string"},"alt":{"type":"string"},"name":{"type":"string"},"icon":{"type":"string","default":"mdi:file-image-box"},"buttonClass":{"type":"string","default":"btn btn-sm btn-primary text-white"}},"required":["src","alt","name"],"additionalProperties":false},"default":[]},"pdfs":{"type":"array","items":{"type":"object","properties":{"src":{"type":"string"},"name":{"type":"string"},"icon":{"type":"string","default":"mdi:file-pdf"},"buttonClass":{"type":"string","default":"btn btn-sm btn-primary text-white"}},"required":["src","name"],"additionalProperties":false},"default":[]},"urls":{"type":"array","items":{"type":"object","properties":{"href":{"type":"string","format":"uri"},"name":{"type":"string"},"icon":{"type":"string","default":"mdi:link-variant"},"buttonClass":{"type":"string","default":"btn btn-sm btn-secondary text-white"}},"required":["href","name"],"additionalProperties":false},"default":[]},"team":{"type":"array","items":{"anyOf":[{"type":"string"},{"type":"object","properties":{"id":{"type":"string"},"collection":{"type":"string"}},"required":["id","collection"],"additionalProperties":false},{"type":"object","properties":{"slug":{"type":"string"},"collection":{"type":"string"}},"required":["slug","collection"],"additionalProperties":false}]}},"blogPost":{"anyOf":[{"type":"string"},{"type":"object","properties":{"id":{"type":"string"},"collection":{"type":"string"}},"required":["id","collection"],"additionalProperties":false},{"type":"object","properties":{"slug":{"type":"string"},"collection":{"type":"string"}},"required":["slug","collection"],"additionalProperties":false}]},"coverImage":{"type":"object","properties":{"src":{"type":"string"},"alt":{"type":"string"},"name":{"type":"string"},"icon":{"type":"string","default":"mdi:file-image-box"},"buttonClass":{"type":"string","default":"btn btn-sm btn-primary text-white"}},"required":["src","alt","name"],"additionalProperties":false}},"required":["name","date","placement","icon"],"additionalProperties":false,"description":"Achievements schema"}},"$schema":"http://json-schema.org/draft-07/schema#"}