{
	"$schema": "https://skornel02.hu/schema/competition.schema.json",
	"name": "Http Alapítvány - Cisco Webex Hacathlon - 2019",
	"date": "2019-04-12",
	"placement": "I. place",
	"icon": "mdi:trophy-award",
	"highlighted": false,
	"images": [
		{
			"src": "/src/images/competitions/Webex-Teams-Hackathlon-2019-photo.jpeg",
			"alt": "Competition certificate",
			"name": "Certificate"
		}
	],
	"team": ["erik", "partfo", "sk"]
}
