{
	"$schema": "../../schemas/competition.schema.json",
	"name": "II. Merklik László problémamegoldó verseny",
	"date": "2021-04-15",
	"placement": "Finalist",
	"icon": "emojione-monotone:1st-place-medal",
	"highlighted": false,
	"images": [
		{
			"src": "/src/images/competitions/Merklik-2021.jpeg",
			"alt": "Competition certificate",
			"name": "Certificate"
		}
	],
    "team": ["partfo", "sk", "avar"]
}
