{
	"$schema": "https://skornel02.hu/schema/achievements.schema.json",
	"name": "Bakonyi Bitfaragó Bajnokság - 2021",
	"date": "2021-11-20",
	"placement": "I. place",
	"icon": "mdi:trophy-award",
	"highlighted": false,
	"images": [
		{
			"src": "/src/images/competitions/Bakonyi-Bitfarago-Bajnoksag-2021.jpeg",
			"alt": "Competition certificate",
			"name": "Certificate"
		}
	],
	"urls": [
		{
			"name": "Repository",
			"href": "https://github.com/skornel02/b3-2021",
			"icon": "mdi:source-repository"
		},
		{
			"name": "Website",
			"href": "https://mik.uni-pannon.hu/szervezet/hirek/kar-tovabbi-hirei/bakonyi-bitfarago-bajnoksag-2022"
		}
	],
	"team": ["partfo", "sk", "avar"]
}
