{
	"$schema": "https://skornel02.hu/schema/achievements.schema.json",
	"name": "Neumann János Egyetem Programming contest - 2020",
	"date": "2021-01-27",
	"placement": "II. place",
	"icon": "mdi:medal-outline",
	"highlighted": false,
	"pdfs": [
		{
			"name": "Competition certificate",
			"src": "/competitions/GAMF programozó verseny 2020.pdf"
		}
	],
	"team": ["partfo", "erik", "sk"]
}
