{
	"$schema": "https://skornel02.hu/schema/competition.schema.json",
	"name": "Ifjútudosok tudományos vetélkedő - 2022 - Traditional category",
	"date": "2022-03-08",
	"placement": "Finalist",
	"icon": "emojione-monotone:television",
	"iconColor": "grey",
	"highlighted": false,
	"images": [
		{
			"src": "/src/images/competitions/Ifju-Tudosok-2022.jpeg",
			"alt": "Competition certificate",
			"name": "Certificate"
		}
	]
}
