{
	"$schema": "../../schemas/competition.schema.json",
	"name": "Ágazati és ágazaton belüli specializáció szakmai érettségi vizsgatárgyak versenye - 2022",
	"date": "2022-04-13",
	"placement": "First place",
	"icon": "emojione-monotone:1st-place-medal",
	"highlighted": true,
	"images": [
		{
			"src": "/src/images/competitions/ASZEV2022.jpeg",
			"alt": "Competition certificate",
			"name": "Certificate"
		}
	],
	"urls": []
}
