{
	"$schema": "https://skornel02.hu/schema/achievements.schema.json",
	"name": "WebGraf - 2020",
	"date": "2021-01-05",
	"placement": "II. place",
	"icon": "mdi:medal-outline",
	"highlighted": false,
	"team": ["partfo", "sk", "avar"],
	"coverImage": {
		"src": "/src/images/competitions/Webgraf-2020-Cover.jpg",
		"alt": "Podium image",
		"name": "Podium image"
	}
}
