{
	"$schema": "https://skornel02.hu/schema/competition.schema.json",
	"name": "Accenture Java competition - 2020",
	"date": "2020-07-06",
	"placement": "Finalist",
	"icon": "mdi:star",
	"highlighted": false,
	"pdfs": [{"name": "Reference", "src": "/assets/competitions/Accenture Java 2020.pdf"}],
	"team": ["fmate", "sk", "vtibor"]
}
