{
	"$schema": "https://skornel02.hu/schema/achievements.schema.json",
	"name": "Skills Junior 2022 - Web category",
	"date": "2022-04-02",
	"placement": "I. place",
	"icon": "mdi:trophy-award",
	"highlighted": false,
	"images": [
		{
			"src": "/src/images/competitions/Skills-Junior-Web-2022.jpeg",
			"alt": "Competition certificate",
			"name": "Certificate"
		}
	],
	"urls": [
		{
			"name": "Official website",
			"href": "https://skillsit.hu/hirek/nagyszeru-eredmenyek-a-skills-junior-webfejleszto-kategoriajanak-dontojen/"
		}
	]
}
